comparison_type,paper,paper_protocol,paper_metric,our_protocol,our_metric,verdict
apples_to_apples_or_close,P1 drift-adaptive Coswara temporal,Chronological development/postdevelopment cough model,Coswara development AUROC 0.668; postdevelopment AUROC 0.597,ComParE+IS10 strict early-to-late temporal,"AUROC 0.698, AUPRC 0.896, BA 0.656",Our final temporal AUROC is higher than P1 postdevelopment but protocols differ; both support drift sensitivity.
apples_to_apples_or_close,P6 ENCL-DNN Coswara,"Coswara internal cough audio, calibrated DNN",AUROC 0.834; ECE 0.089 after ENCL,ComParE+IS10 existing participant split,"AUROC 0.897, AUPRC 0.863, ECE 0.170 for final selected row","Our AUROC higher, but ENCL calibration is better; not identical features/splits."
apples_to_apples_or_close,P9 OpenSMILE speech/vowels,"Coswara vowel speech, OpenSMILE, RF/ANOVA","Accuracy 76.47% (/a/), 75.54% (/e/ and /o/)",ComParE+IS10 speech 10-fold paper-comparable CV,"Best speech AUROC 0.806, AUPRC 0.705, BA 0.732","Metric differs (accuracy vs AUROC) but modality/feature family are close; our speech result is moderate, not SOTA."
apples_to_apples_or_close,P10 DNDF Coswara,"Coswara cough, RFECV+BO+SMOTE+threshold moving",DNDF AUC 0.92,ComParE+IS10 cough 10-fold paper-comparable CV,Best cough CV AUROC 0.819 +/- 0.029; AUPRC 0.728,We do not match P10 under the closest paper-style CV result.
apples_to_apples_or_close,P10 DNDF COUGHVID,COUGHVID internal cough evaluation,DNDF AUC 0.93,COUGHVID internal baselines and Coswara-to-COUGHVID external transfer,COUGHVID internal MFCC AUROC 0.781; external transfer AUROC 0.543,Internal COUGHVID is lower and external transfer is far lower; external transfer is stricter than their per-dataset internal evaluation.
apples_to_oranges,P7 HST,"HST on Cambridge/COUGHVID tasks, spectrogram transformer",Over 90% AUC reported for COVID detection,"Feature-selection + classical model bank, temporal/external stress",Final internal AUROC 0.897; external AUROC 0.543,"Architecture/protocol mismatch; HST is an advanced architecture reference, not directly comparable to our conservative external result."
apples_to_oranges,P8 SympCoughNet,Symptom-assisted attention with cough audio,"AUROC 94.74%, PR 91.62%",Audio-only main model plus symptoms as confounding audit,Symptoms-only metadata AUROC 0.932; final audio/multimodal internal AUROC 0.897,Not comparable because symptoms are used as predictive prior in P8 and as audit/confounder in ours.
apples_to_oranges,P18 smartphone cough,"Nested leave-p-out, MFCC/SFS/CNN-LSTM-ResNet and Sarcos validation",Coswara AUC 0.98; Sarcos after SFS about 0.94,Coswara ComParE+IS10 and COUGHVID external transfer,CV cough AUROC 0.819; external COUGHVID AUROC 0.543,"Different data construction, validation unit, and external dataset; not a fair direct scoreboard comparison."
